{
  "$schema": "./protocol/schemas/protocol-lock.schema.json",
  "schemaVersion": 1,
  "revision": "health-only-2026-10-30-9d6e5373",
  "status": "captured",
  "generatedAt": "2026-10-30T15:55:06.959Z",
  "source": {
    "repository": "https://github.com/omnipair/dusk",
    "branch": "feat/health-only-liquidations",
    "gitCommit": "9d6e53738f6c5dd550d539d8c045888b819c5ec8",
    "worktreeFingerprintSha256": "fd0c0b00026c1a19aa2c9cbcb346ddfba646ef717f455f4118bf8b1f5bed8585"
  },
  "toolchain": {
    "anchor": "0.31.1",
    "rust": "1.97.1",
    "solana": "4.1.0-rc.1",
    "surfpool": "1.2.0",
    "node": "24.9.0"
  },
  "programs": [
    {
      "name": "dusk",
      "programId": "JA8Zxxm4t4zopBL8e3dQQXWfQ3a5pBUPY9Sp9RnybV2X",
      "binary": {
        "path": "artifacts/dusk.so",
        "sha256": "f61dedf4aaaae278c4af651630a48ec6d95c9ff444020d5e1b497705379bdf66"
      },
      "idl": {
        "path": "artifacts/dusk.json",
        "sha256": "eb1081be876eab2721d962e277bb09da789b334abbf4ab6344b413a80b0fd894"
      }
    },
    {
      "name": "leverage_delegate",
      "programId": "AXNfmZt5e1UM4daeTzW3H7zNo4boobBcnFm8RzJYxvAv",
      "binary": {
        "path": "artifacts/leverage_delegate.so",
        "sha256": "602e1c9934af11796967453e155417da5a97a8085ca450365a069dc6daaea32b"
      },
      "idl": {
        "path": "artifacts/leverage_delegate.json",
        "sha256": "dda5cbb8a48eff8753d9a4a235f19531293f2d475ab4fef9a3c9b64279b4ccd0"
      }
    }
  ],
  "sdk": {
    "path": "artifacts/dusk-sdk.tgz",
    "sha256": "3ec4a888f4723aea24063cc73e3599ce3600128241abf9b366180f60020887c3"
  },
  "compatibility": {
    "accountLayoutFingerprintSha256": "310337422f7f11432c7e93a08f2cd41a372757eed23fbd05dd86193254981bec",
    "instructionFingerprintSha256": "d3cd084486f16f7714cfe4f126943d366a73b3fc7601ea49d7516b8d3983ccaa",
    "eventFingerprintSha256": "8c76e6124a2bc20434c2a361c3c579d0682d97d1c434114051d5f0fda2ff2cb2",
    "errorFingerprintSha256": "14cf3e195ffb812faf3a4359cf49ecd2d834ca9861eea62277519064d3b1fa5b",
    "pdaFingerprintSha256": "37ff74e3ebc734fd3b58edbdaf0939296e333364b34ddee77662f9481551f2b8"
  }
}
